game_id,name,release_date,total_reviews,positive_percent,genres,tags,current_price,discounted_price,owners,days_after_publish,review,owner_min,owner_max,owners_log_mean
2162800,shapez 2,2024-08-15,10603,98,"Casual, Indie, Simulation, Strategy, Early Access",Casual;Indie;Simulation;Strategy;Early Access,$8.99,$6.29 USD,"200,000 .. 500,000",337,"Really fun and chill game Mesmerizing ... Thumbs Sideways Great Tech, Underwhelming Gameplay Loop Theres a lot to like about Shapez 2 on the surface. The factory structures are visually interesting and suggest a promising future. The graphics are clean and modern, the interface is intuitive and slick, and I didnt encounter a single bug during my playthrough which is no small feat for an early release. However, the core gameplay loop left me wanting more. The constraints system which could have added challenge and creativity barely factored into my experience. I never came close to hitting the structure limits, so it didnt really influence my designs. Side quests start off engaging but quickly become repetitive and feel disconnected from the rest of the game. Once youve completed the factory for a quest, it has no ongoing purpose, making it feel like a one-and-done effort with little payoff. The operator badge path alone provided more than enough science to complete progression, making side quests largely irrelevant past the early game. Unlike Factorio, where your early builds continue to support and evolve into your later infrastructure, Shapez 2 factories feel isolated and disposable. Each one solves a narrow problem, then gets ignored. Theres no sense of a growing, interconnected machine. The shape mechanics, while initially novel, lack depth. Id love to see a system where advanced shapes are constructed from simpler ones a hierarchy where youre constantly building up from base components. Imagine only starting with quarter circles and squares and needing to combine and split them to reach complex forms similar to the color mixing system, which is far more satisfying in comparison. Lastly, it would be a huge improvement if producing shapes was actually necessary to build new structures. That would tie your creations directly to progression and give a real sense of purpose to what youre building. Bottom Line: Shapez 2 has excellent production values and real potential, but the current gameplay loop feels shallow. Heres hoping future updates bring more depth and interconnectedness to match the polish.Thumbs Sideways Great Tech, Underwhelming Gameplay Loop Theres a lot to like about Shapez 2 on the surface. The factory structures are visually interesting and suggest a promising future. The graphics are clean and modern, the interface is intuitive and slick, and I didnt encounter a single bug during my playthrough which is no small feat for an early release. However, the core gameplay loop left me wanting more. The constraints system which could have added challenge and creativity barely factored into my experience. I never came close to hitting the structure limits, so it didnt really influence my designs. Side quests start off engaging but quickly become repetitive and feel disconnected from the rest of the game. Once youve completed the factory for a quest, it has no ongoing purpose, making it feel like a one-and-done effort with little payoff. The operator badge path alone provided more than enough science to complete progression, making side quests largely irrelevant past the early game. Unlike Factorio, where your early builds continue to support and evolve into your later infrastructure, Shapez 2 factories feel isolated and disposable. Each one solves a narrow problem, then gets ignored. Theres no sense of a growing, interconnected machine. The shape mechanics, while initially novel, lack depth. Id love to see a system where advanced shapes are constructed from simpler ones a hierarchy where youre constantly building up from base components. Imagine only starting with quarter circles and squares and needing to combine and split them to reach complex forms similar to the color mixing system, which is far more satisfying in comparison. Lastly, it would be a huge improvement if producing shapes was actually necessary to build new structures. That would tie your creations directly to progression and give a real sense of purpose to what youre building. Bottom Line: Shapez 2 has excellent production values and real potential, but the current gameplay loop feels shallow. Heres hoping future updates bring more depth and interconnectedness to match the polish. A very fun automation game, I was glued to it for hours. Juegazo",200000.0,500000.0,316227.7660168382
2201320,Date Everything!,2025-06-17,3364,95,Simulation,Simulation,$19.99 USD,$19.99 USD,"0 .. 20,000",31,i made my bed creak funny CAM Game good I 1000 loved this game!! As I have played it for over 180 hours and loved 99 of it. All the characters are fun and well written that im too attached to them to do a Hate everything run. The art is amazing. On my third run of the game and im still having a blast.,0.0,20000.0,0.0
2252570,Football Manager 2024,2023-11-06,14564,90,"Simulation, Sports, Strategy",Simulation;Sports;Strategy,$39.99 USD,$39.99 USD,"1,000,000 .. 2,000,000",620,เปนเกมทเลนแลวเลกยากจงๆ สนก ครบ จบ ทเกมน รอ ภาคใหมครบ Awsome game. . great Game Perfektní fotbalový simulátor,1000000.0,2000000.0,1414213.5623730957
2277560,WUCHANG: Fallen Feathers,2025-07-24,0,0,"Action, Adventure, RPG",Action;Adventure;RPG,$34.99 USD,$34.99 USD,"0 .. 20,000",-5,,0.0,20000.0,0.0
2300320,Farming Simulator 25,2024-11-12,22938,83,Simulation,Simulation,,$44.98 USD,"1,000,000 .. 2,000,000",248,sabırı güçlendirir je kan je eigen gang gaan en dat maakt het leuk if I get in my volvo truck the sound of the game just stops please fix this other than that is fun to play with friends Otimo jogo sempre evoluindo o Gameplay e conteudo,1000000.0,2000000.0,1414213.5623730957
2322010,God of War Ragnarök,2024-09-19,21190,87,"Action, Adventure, RPG",Action;Adventure;RPG,$49.99 USD,$49.99 USD,"1,000,000 .. 2,000,000",302,best game i've ever played вывыфвфывфывфывфыв Great Storytelling!! Great Game play!! Great game mechanism and It's nailed !!! This game is amazing. Such a great story! Its amazing,1000000.0,2000000.0,1414213.5623730957
2336880,Destiny 2: The Final Shape,2024-06-04,5316,79,"Action, Adventure, Free To Play",Action;Adventure;Free To Play,$29.99,$7.49 USD,"0 .. 20,000",409,"Difinitivamente no hay como jugar Destiny 2 con todas las expansiones muy buenos paisajes , exelente grafico y ni hablar de la gran variedad de cosas que hacer , extraño destiny 1 pero el 2 en verdad es muy confortable PD TE AMO BUNGIE PORQUE RENUNCIASTE A HALOOOOOOOOO un DLC que finalizo, no toda una saga, sino todo un contenido que hacia falta rellenar en este juego, si bien no llega al nivel de forzaken, la verdad esque este dlc te trae mecanicas nuevas de exploracion que hasta interactuas con el ambiente de cada zona, puede ser lineal el mapa, si, pero no quita el hecho de que por cada zona hay algun detalle hermoso que hasta sin contar con su raid, el dlc es todo lo que tenia que ser para cerrar una gran saga. su incursion toma fuerte inspiracion filosofica y tomando una atmosfera que te hace sentir que si no ganas esto, es el fin de todo.... Una raid muy inmersiva y un contenido fuera de raid bastante fresco y divertido, lo recomiendo mucho. PD: voy a extrañar mucho leer libros de lore de toda esta saga de luz... y oscuridad Primero que nada, el juego no es del todo malo, tiene muchas cosas increíbles y muchísimo contenido ademas que desafíos interesantes y demandantes. Los DLC's son muy llamativos y dan horas de contenido que mucho es de calidad, ademas que al comprarlos no se sienten como pay to win de hecho en el contenido gratuito se consiguen mejores cosas simplemente amplían tu arsenal llenándolo de posibilidades. Con este juego he pasado horas increíbles, tanto en solitario contemplando los paisajes como en con mis amigos completando actividades y mejorando el armamento Pero entonces por que no lo puedo recomendar? Pese a lo bueno que es, el juego es horrible para nuevos jugadores, tiene una trama e historia fascinante y entrañable, pero el hecho de que no este completa y no se pueda jugar de ningún modo coherente simplemente hace que te sientas desubicado y con muchas dudas con el juego. Muchos de los personajes tiene buena escritura pero están entrelazados a eventos pasados que ya no se pueden jugar, entendiendo el porque están ahí pero sin transmitir emoción que muchos veteranos si tuvieron haciendo una experiencia poco homogénea en la comunidad. Ademas de las actividades gratuitas y de early game el juego tiene una curva de dificultad muy retadora, obligándote a jugar con amigos o aprendiendo mucho meta y mecánicas. El tutorial no sirve como introducción ni de dichas mecánicas muestra lo básico pero no te dice nada de las stats ni tampoco te da contexto suficiente de la historia. Al forzar a otros a pagar por actividades a sobreprecio y a entrar a una historia muy desconectada hace que sea difícil convencer a otros jugadores y enseñarles a jugar este juego. Ademas últimamente las decisiones de Bungie son cada vez más cuestionables en su dirección y el hecho de que se borra contenido sin la posibilidad de re jugarlo hace que te plantees 2 veces si realmente vale la pena en invertir en el. Seguiré jugandolo probablemente mucho más tiempo y probablemente también le agarres cariño pero es difícil y cada vez se pone peor... A satisfiying conclusion of the past 7 years of story. Even better raid. I have a blast playing this, but it's sad that despite the success, Bungie as a company still have to cut lots of the talents that worked in this masterpiece. Prismatic has been very refreshing and fun to play with. Despite the dwindling in-game players, lots of the activity are still playable and I do enjoy teaching the mechanic of old dungeons to new players. All in all, I hope this game can still going strong, but seeing the new Bungie, I can't keep my hope up. So I try to enjoy the moment and cherish the good memories,",0.0,20000.0,0.0
2379780,Balatro,2024-02-20,130436,97,"Casual, Indie, Strategy",Casual;Indie;Strategy,$7.99,$7.19 USD,"2,000,000 .. 5,000,000",514,"Jogo mais brabo que ja joguei, tomem 4 zolpidem vao jogar balatro enquanto desfrutam de 1L de cerveja gelada, serio bom pra krl Gambling, but better! Es god 1010 You just need to believe in the heart of the cards. I have another 9 hours on mobile. This game is so addicting, I love TCGs and other deckbuilders. was a big poker player. Very highly addicting.",2000000.0,5000000.0,3162277.6601683795
2399830,ARK: Survival Ascended,2023-10-26,74043,59,"Action, Adventure, Indie, Massively Multiplayer, RPG, Early Access",Action;Adventure;Indie;Massively Multiplayer;RPG;Early Access,$20.99 USD,$20.99 USD,"2,000,000 .. 5,000,000",631,"idk i just like this game 好玩 BEST GAME EVER TAKES NO TIME TO GET GOING Ark will be Ark; all games have issues and unfortunately Ark - and this applies to both Survival Evolved and Survival Ascended - has been plagued with optimization issues and the near-guaranteed issues after any major update. That is not something I believe anyone is denying. However you can't take all the possible issues and compare them to your experience. Mine has been pretty light in terms of issues or bugs encountered, and definitely within reason for any game I would play and at the time of this writing, the game is still within Early Access. Ark has held a special place in my list of games ever since it's initial release while I was on a shoddy laptop. I would recommend this game to anybody who enjoys Survival games. It's spin on the genre - and the inclusion of Big Reptile - make it an experience even if you play casually. I would recommend any new players hold off on any Flying mounts until they really explore the map, it's gorgeous and such a different experience on the ground than the detached feel you eventually get flying over the map. A gorgeous flight, but you tend to get into that Autopilot of just going from A to B. Walk around, die to Raptors a couple hundred times, live the Ark experience. For fans of Evolved, Ascended has taken Evolved and made it gorgeous, The enhancements to the UI and certain QoL features make this game an amazing remaster. The integrated modding system is far easier than the previous methods for solo play and managing a Server. There is more of a monetary system for certain mods, but the Free original DLC was a great choice and all the better that they reintroduce new DLC and Content that you can buy to enhance your experience for those who want more than a basic remaster. Whether you're looking for an experience solo, or with friends, there's so much this game has to offer, I find all these arguments of Pay-to-win are null. It doesn't detract from the base experience unless you're looking to hop into Official. At which point Ark has the same experience you'd associate with Rust servers in terms of the tribes you will likely meet. , maybe catch it on the next Sale and if it's not for you - so be it. As much as I would love to like this game, these developers genuinely don't deserve anymore money. They lack the capability or will to optimize virtually fing anything, there's a million and a half problems you run into trying to play the game. Keeping the game going and playing normally is like walking on a tight rope. You change one setting and it all just fumbles down. On top of that, the games enormous. I have over 6000 hours in Atlas, and Atlas was ran better than this. It makes no sense. If this game were owned by anyone else, it would be amazing. As far as the game itself, it can be fun, for sure. Tons of content, things to do, farm, etc. But holy hell are there bugs and optimization issues. Just play something else. Save yourself the grief.",2000000.0,5000000.0,3162277.6601683795
2404880,Car Dealer Simulator,2025-05-29,2361,83,"Casual, Indie, Simulation",Casual;Indie;Simulation,$5.73,$5.15 USD,"100,000 .. 200,000",50,"like it Fun and relaxing игра охуенная, но не очень хорошо оптимизирована Actually fun game would recommend Very simple game, overly simple. No character progression or skill tree. No staff progression, can only buy cars one way. no auctions or customer trade in. The cars you sell just vanish into thin air. Very small map to explore, just not very much to do. recovery truck is pointless. All the cars repair mechanics are identical. Who polishes car with water? just doesn't make sense. Cant even buy wheels for the car. Disappointing overall.",100000.0,200000.0,141421.3562373094
2456740,inZOI,2025-03-27,20498,77,"Adventure, Casual, Simulation, Early Access",Adventure;Casual;Simulation;Early Access,$24.99 USD,$24.99 USD,"1,000,000 .. 2,000,000",113,"величайшая афера года в игровой индустрии, это без сомнений.Впрочем, отличный пример продажности игровых журналистов 各种闪退 boa tarde estou nessa pequena mensagem estou com problema no jogo a perte do jogo não estou conseguido botar .Dinheiro estava aparecendo a opção pra colocar agora não esta mais fora esse problema gostei muito do jogo e dos gráficos оно сдохло не успев родиться Dieses Spiel hat sehr viel Potenzial.",1000000.0,2000000.0,1414213.5623730957
2537590,Microsoft Flight Simulator 2024,2024-11-19,13819,47,Simulation,Simulation,$69.99 USD,$69.99 USD,"100,000 .. 200,000",241,lo mejor good graphics! hra je skvělá ITS GOD FIN TO FLIY PLANE AND SIMILUTION,100000.0,200000.0,141421.3562373094
2567870,Chained Together,2024-06-19,46350,90,"Adventure, Casual, Indie, Simulation",Adventure;Casual;Indie;Simulation,$2.99 USD,$2.99 USD,"2,000,000 .. 5,000,000",394,"1 Super fun, while not really something you see yourself playing for hours, but it can be fun with the right people! 好玩 最后游戏的链子消失 内心的链子永远存在 永远链在一起 ez game glichy",2000000.0,5000000.0,3162277.6601683795
2604420,Euro Truck Simulator 2 - Greece,2024-12-04,1109,88,"Indie, Simulation",Indie;Simulation,$6.05,$5.44 USD,"0 .. 20,000",226,"id love to say it looks great but it kinda aint cos the game engine is pure garbage. Very unoptimized but then again most of the game is just like that tbh. I like this DLC, Greece looks cool, I like it! The most detailed DLC to date, and one of my favourites. You really should get this alongside West Balkans for the full experience considering the map is small. The cities are beautiful, the islands are all unique and memorable. Greece DLC will crash your game. Do not buy!! My, my such a beautiful dlc, if you already have eurotruck sim, get yourself this dlc as well, such a gem!",0.0,20000.0,0.0
2622380,ELDEN RING NIGHTREIGN,2025-05-29,90161,82,"Action, RPG",Action;RPG,$25.99 USD,$25.99 USD,"2,000,000 .. 5,000,000",50,"stop running for flasks we need more levels bro Fun Realmente bem diferente dos outros Souls e muito bom tambem, mas nao vale 200 conto really pretty good. Not even close to something like the original game but its fun for the game that it is. Definitely can be a great game if they continue to gro it into something deeper. I think it's still in it's juvenile stage. Hidetaka Miyazaki, you little fucker. You made a shit of piece with your trash Nightrein. It's fucking bad, this trash game. I will become back my money. I hope you will in your next time a cow on a trash farm you sucker.",2000000.0,5000000.0,3162277.6601683795
2625420,Drive Beyond Horizons,2025-03-24,8276,79,"Action, Adventure, Casual, Indie, Racing, Simulation, Early Access",Action;Adventure;Casual;Indie;Racing;Simulation;Early Access,$12.49 USD,$12.49 USD,"100,000 .. 200,000",116,Demo war vielversprechend aber das Spiel selber läuft absolut schlecht. GREAT game it is still development so its still a little buggy but grab some frens for a chill ride and have fun building cool cars hopfully they keep adding more Encore quelques bugs. Mais ça va... twin turbo lada with v8 engine Game is alright. But half of it is in french while the setting says English. Also the multiplayer could use some refining.,100000.0,200000.0,141421.3562373094
2669320,EA SPORTS FC™ 25,2024-09-26,80447,51,"Simulation, Sports",Simulation;Sports,$69.99 USD,$69.99 USD,"5,000,000 .. 10,000,000",295,"Найгірша гра яку ви можете придбати взагалі в житті, Захисники суперника тримають оборону краще ніж під Сталінградом, а воротар особисто будував Китайську стіну. Твої ж гравці не дивлячись на стати будуть сосать все шо попаде до рота, воротар з хворобою Паркінсона, захисники діти шалав а нападники це твій Фізрук помножений на літр водки, дякую ЕА за такі класні емоції сподіваюсь ви всі помрете в муках, а ваші сім'ї будуть горіти в пеклі до кінця нашого світу. Бажаю вам повільної та болісної смерті ut cop kariyer guncelleme getirin artik aqqqqqqqqqq . i broke 5 controllers, 3 screens my table has a massive hole fut champs is so good btw foda",5000000.0,10000000.0,7071067.811865473
2694490,Path of Exile 2,2024-12-06,128571,71,"Action, Adventure, Massively Multiplayer, RPG, Early Access",Action;Adventure;Massively Multiplayer;RPG;Early Access,$29.99 USD,$29.99 USD,"20,000,000 .. 50,000,000",224,"Great game. Invested quite a bit of time in this, and this is easier to understand for me than PoE1. Can't wait for full release. . Jogo mt bom ! 2 Big things I noticed as a moviestory guy. Not only do the graphics visually stand out to me, The quests themselves make sense. In other smash games I do not even pay attention to the words or the quest itself...because no effort has been made to make it interesting, just 1 mcguffinDeus ex machina after another. But the quests here have thoughtful, intriguing mystic level story around them....almost movie'ish level. Its made it much more interesting for me personally. nice",20000000.0,50000000.0,31622776.601683773
2824490,He is Coming,2025-07-17,238,87,"RPG, Strategy, Early Access",RPG;Strategy;Early Access,$7.99,$5.19 USD,"0 .. 20,000",1,"me like This is one of the games of all time. This game boils everything that I love about roguelikesroguelites and wraps it up in a very minimalist but effective retro aesthetic. I suck at it and I love it. This is a great game with huge potential. It's already fun and enjoyable yet it would require some balancing to make it perfect. Now it's only 1 day after he came out and it's still in early access, let's trust the devs to make some adjustements soon : cool time killer, i would give a 810 needs more game modes. give skins boons, make it so its worth the grind.",0.0,20000.0,0.0
2840770,Avatar: Frontiers of Pandora™,2024-06-17,4208,68,"Action, Adventure",Action;Adventure,$55.99,$16.79 USD,"100,000 .. 200,000",396,good I tend to enjoy adventuring; I WANT MORE ANIMALS CHAT Es muy complejo innecesariamente y no me gusta que sea en primera persona. good game A boring game. I lost interest before I reached 2 hours of gameplay. Bland cookie cutter Ubisoft rubbish.,100000.0,200000.0,141421.3562373094
2919660,JudgeSim,2024-07-17,979,84,"Casual, Indie, Simulation, Strategy",Casual;Indie;Simulation;Strategy,$3.49 USD,$3.49 USD,"100,000 .. 200,000",366,"param bitti akıl sağlığım 15'e düştü eşim benden evlilik yıl dönümü hediyesi olarak yurt dışına çıkmak istiyor bunun içinde 7500 gerekiyor kabul edersem iflas ediyorum oyun bitiyor kabul etmezsemde akıl sağlığım düşüyor tımarhaneye atıyorlar ben şimdi ne yapacağım amk sonsuz paradoksa girdim you can execute insane people. 1110 JudgeSim, Banana Republic adlı kurgusal bir adada hakim rolüne büründüğünüz, metin tabanlı bir simülasyon oyunu. Davaları okuyor, delilleri inceliyor, sanıklarla konuşuyor ve hukuki kararlar veriyorsunuz. Artılar: Sürükleyici davalar: Her vaka ilgi çekici ve dikkatli okuma, çözümleme gerektiriyor. Davalar metinle anlatıldığı için zihin gücü ön planda ve kararlar ciddi hissettiriyor . Tekrar oynanabilirlik: Farklı sonuçlara ulaşmak, yargılamalardaki farklı yolları keşfetmek tekrar etmek için motive ediyor . Minimalist atmosfer: Grafikler basit, ama bu metin odaklı oynanışa katkıda bulunuyor. Phoenix Wright kadar çarpıcı değil ama türünde başarılı Epic Games Store . Eksiler: Monoton müzik: Müzikler kısa ve çabuk tekrara düşüyor; bazı kullanıcılar sıkıcı bulabiliyor . Şans faktörü: Bazen davaların ve ceza sonuçlarının tamamen zar atışına dayandığı anlar var ki bu, temelde beceriye dayalı yargılamayla çakışabiliyor . Basit görsel stil: Kağıt üzerinde hazırlanmış gibi duran grafikler, bazı oyunculara Papers, Please benzeri ama daha zayıf bir deneyim sunuyor. entretenido y facil de jugar Güzel",100000.0,200000.0,141421.3562373094
3008130,Dying Light: The Beast,2025-08-22,0,0,"Action, Adventure, RPG",Action;Adventure;RPG,$44.99 USD,$44.99 USD,"0 .. 20,000",-34,,0.0,20000.0,0.0
