game_id,name,release_date,total_reviews,positive_percent,genres,tags,current_price,discounted_price,owners,days_after_publish,review,owner_min,owner_max,owners_log_mean
466560,Northgard,2018-03-07,51293,84,,nan;Experimental,$nan,,"2,000,000 .. 5,000,000",4,"Справжні вікінги! і трошки англійців no Très bon RTS aux mécaniques originales. Le tout est bien équilibré bien que les factions jouables soient assez typées. дерьмо ебаное, лаги нереальные. Создатели - капиталистические свиньи Отличная игра, в главном меню регулярные зависания, если тебе повезло и ты попал в промежуток между фризами, то ты можешь перейти в одиночку, сетевую или кампанию. Когда ты запускаешь любой режим, то экран загрузки до ходит до финала и игра просто зависает. Some recent issues make it less enjoyable.",2000000.0,5000000.0,3162277.6601683795
1364780,Street Fighter™ 6,2023-06-02,36060,80,"Action, Adventure",Action;Adventure;Experimental,$41.99,$29.99 USD,"2,000,000 .. 5,000,000",4,"amazing throw loop, do it again Don't let the review bombing affect your decision, yes old players got screwed by Capcom, but that doesn't take away from the overall experience, specially if you're a new player. This is probably the best fighting game we've gotten since the 90's, it's full of content, the mechanics are great for old and new players alike. If you enjoy fighting games, you owe it to yourself to try this game. Tekken 8 and MK1 have no chance against this gem. Os engravatados venceram, eu comprei um boneco. 好玩爱玩 好玩爱玩 Some recent issues make it less enjoyable.",2000000.0,5000000.0,3162277.6601683795
3097560,Liar's Bar,2024-10-02,42147,88,"Casual, Indie, Simulation, Strategy, Early Access",Casual;Indie;Simulation;Strategy;Early Access;Experimental,$5.59,$3.99 USD,"2,000,000 .. 5,000,000",4,"10 gigas pour Liar's mid grosse hagra 好 好 прикольная игра, ждем расширения персонажей, скинов, и в особенности значок игры Some recent issues make it less enjoyable.",2000000.0,5000000.0,3162277.6601683795
466560,Northgard,2018-03-07,51293,83,,nan;Experimental,$nan,,"2,000,000 .. 5,000,000",5,"Справжні вікінги! і трошки англійців no Très bon RTS aux mécaniques originales. Le tout est bien équilibré bien que les factions jouables soient assez typées. дерьмо ебаное, лаги нереальные. Создатели - капиталистические свиньи Отличная игра, в главном меню регулярные зависания, если тебе повезло и ты попал в промежуток между фризами, то ты можешь перейти в одиночку, сетевую или кампанию. Когда ты запускаешь любой режим, то экран загрузки до ходит до финала и игра просто зависает. Some recent issues make it less enjoyable.",2000000.0,5000000.0,3162277.6601683795
2104890,RoadCraft,2025-05-20,7417,70,"Adventure, Simulation",Adventure;Simulation;Experimental,$41.98,$27.99 USD,"200,000 .. 500,000",5,"The game crashes constantly. Two save files corrupted. One of which had 13 hours on it. This game is honestly terrible. Песочница с машинками для настоящих мальчиков Было очень спокойно и безмятежно, пока я не погрузил в течении 40 минут 27 стальных балок на тяжёлый перевозчик, медленно начал ехать на базу, грузовик задел камушек, начал трястись как ядерный атом и грузовик начал просто на куски разлетаться по всей карте, будто попал в чёрную дыру, резко вернул летающий перевозчик на базу, а все эти 27 несчастных стальных балок застыли в воздухе и их не достать. А так игра очень успокаивает нервы конечно. it is the best only car game get it now Got to play once and now game wont launch just black screen then doesnt respond cant even get refunded waste of 50 dollars I expect to see bugs this early in the development phase. The bugs I have experienced are minor except for one that just recently happened. My game save of 60.2 hours was completely erased. I am hoping this matter can be resolved but it is not the end of the world to start over. The game is enjoyable and fun. Great concept. With developers that actually care and listen, this game is not only a hit but, has to opportunity to remain one for a long time. Keep up the great work. If you have patience and time, then this game is for you. Some recent issues make it less enjoyable.",200000.0,500000.0,316227.7660168382
2141730,Backrooms: Escape Together,2022-10-18,19834,84,"Action, Adventure, Casual, Indie, Early Access",Action;Adventure;Casual;Indie;Early Access;Experimental,$8.69,$5.79 USD,"500,000 .. 1,000,000",5,"Неплохой Гейм-Плей, звуковое сопровождение и миссии на логику. I think everyone should play this, its a really fun game from the looks of it. Its sometime laggy. But i can asure you its fun Для анрила 5 игра выигрывает свое оптимизацией. КЕЕКПЕП Отличный хорор. Some recent issues make it less enjoyable.",500000.0,1000000.0,707106.7811865465
815370,Green Hell,2019-09-05,61104,84,"Action, Adventure, Indie, Simulation",Action;Adventure;Indie;Simulation;Experimental,$18.73,$3.12 USD,"2,000,000 .. 5,000,000",5,"Toller Service. Tolles Game! Playing multiplayer is a game changer. I really like that you can change the settings to get rid of certain bugsanimals, the leeches freak me tf out makes me cream good game MUITO BOM Some recent issues make it less enjoyable.",2000000.0,5000000.0,3162277.6601683795
2604420,Euro Truck Simulator 2 - Greece,2024-12-04,1076,85,"Indie, Simulation",Indie;Simulation;Experimental,$9.07,$6.05 USD,"0 .. 20,000",5,"Nice Greek Video merci One of the most beautiful dlcs they made however it does not run that great with occasional lag spikes. Otherwise solid 910 bEuro Truck Simulator 2 - Greeceb DLC Řecka ukazuje, co dokáží vývojáři SCS Software se svým enginem a nápady. Ačkoli se může zdát, že jde jen o jednu zemi, mýlíte se, obsahuje 15 měst a 5 ostrovů, kde je vše propracováno do posledního detailu, například nevýrazné vodorovné značení na silnicích, firmy, chodci ve městě, vyhlídky, budovy a další stavby které jsou většinou dělané na míru, takže se opakují minimálně. Další věcí, kterou ocení lidé, kteří mají rádi výzvy, jsou užší silnice a možnost svážet zakázky do hotelových resortů. Překvapily mě zejména řecké ostrovy, kde doporučuji udělat si cestu bez zakázky a kochat se výhledy. SCS Software zde ukázalo, že dokáže nastavit laťku opravdu vysoko a že se můžeme těšit na další rozšíření. Jelikož tomuto DLC nemám co vytknout, mohu ho maximálně doporučit. Dobrze odwzorowane DLC, wąskie wjazdy do firm, strome podjazdy, ładne miasteczka naprawde polecam kupic to DLC Some recent issues make it less enjoyable.",0.0,20000.0,0.0
