game_id,name,release_date,total_reviews,positive_percent,genres,tags,current_price,discounted_price,owners,days_after_publish,review,owner_min,owner_max,owners_log_mean
1601570,The Alters,2028-06-07,2743,89.10609565469234,,,0.0,0.0,"0 .. 20,000",1096,"11 bit studios foi sensacional neste jogo. A impressão que tive é que estou assistindo um grande filme em um cinema. Direção de arte, música, narrativa e todos esses fatores me fizeram continuar na frente do computador curtindo um jogo. Fazia tempo que um jogo não me chamou atenção. A jogabilidade é básica, admito. Contudo acredito que o foco seja outro. A história deste game é digna de filme. Estou gostando demais deste jogo. Team Jan In short - amazing game. I bought this game as soon as I saw an ad based on 11 Bit Studio's reputation for Frostpunk. This game has not disappointed yet, really smooth gameplay. Not certain if my decisions are good but they are interesting. Resource gathering loop is neat and doesn't feel like a grind. Wish Frostpunk 2 had gone in this individual storytelling direction instead of macro. This could become one of my favourite games. 話の内容や世界観等はとても良く続きは気になるが これは普通にムービーゲーでよかったのではと思ってしまうほどに道中が面倒くさいです 別にランダム生成でもないので決められた場所に決められたように設置物を配置していくだけで面白味がない Ｅで登れる崖を見た時に嫌な気がしたんだよなぁこの段差いるかぁ毎回テンポ悪くするだけの演出はＮＧで 素材も機械で掘るからいまいち掘っている感もないし没入できない あとセーブが一日単位なので時間に追われてる人にはオススメできないですその１日もムービーとかの入り次第で時間がすごい変動するからプレイタイムが読めないのがあまりにもネック ストーリーが気になる人で指示通り動くのが好きな人間にはいいんでは [Update 218]",0.0,20008.337807426386,0.0
1650010,RIDE 5,2026-08-23,1854,78.88380044674976,"Racing, Simulation, Sports",Racing;Simulation;Sports,60.64368995252338,12.173923976689863,"50,000 .. 100,000",1760,Normal motosiklet kullanmak daha kolay aw good game slightly touchy controls but get used to them and all that then its a fun great game to mess with 1등 하기 X 1랩이라도 안박고 돌아보기 O Bangeer Ist Super im sale auf jedenfall kaufen [Update 219],48875.45213597203,99317.00766964888,69671.82827115915
1671210,DELTARUNE,2028-06-08,38225,97.18466331629237,"Indie, RPG",Indie;RPG,12.511354274348871,12.18818517452496,"1,000,000 .. 2,000,000",1115,"bGraphicsb bGameplayb bDifficultyb bPerformanceb bStoryb bLengthb bWorthb b--- 4 5 ---b iplaying this game really makes me want to see more of this world and it gives me a sort of feeling that i haven't felt or couldn't replicate since undertale. cannot wait for the next chapters and how this story unfolds.i deltapeak przeszedłem wszystko co narazie jest, i musze przyznać wow, fabuła jest bardzo dobra gameplay też naprawde 1010 Absolute deltarune, obra maestra, 2010 y GOD all i hope is that it doesnt take another 7 years for the next three chapters to release [Update 220]",994668.9607513549,2032487.6411720042,1421848.2231885828
1850570,DEATH STRANDING DIRECTOR'S CUT,2025-04-08,29626,92.16256682431589,"Action, Adventure",Action;Adventure,5.833941965348654,2.316495521893693,"1,000,000 .. 2,000,000",2282,"kojima please can my feet fedex The only way to know if you will like it is bby playing it yourselfb. But, I wanna ramble a bit so here's my review: One of the best games I have played in my life. Finished it thrice on playstation platinum and once on PC 100 as well. h2The Storyh2 list While a bit confusing, it's super unique, emotional and have a lot of moments that definitely stick with you. I'm not gonna say anything else about it, experience it yourself, don't watch trailers or anything. list h2The Gameplayh2 list The Good: - The most important thing in my opinion, you bALWAYSb feel like that you are helping other players. All the time. The only connection that you have with other people is positive, you only interact with other players to help them or be helped by them. And the game gives you constant feedback in that regard with messages telling you how you are being useful to them. - I personally find the gameplay loop to be super engaging delivering packages. Playing on Very Hard and going everywhere by foot it's how I recommend playing it, at least the vast majority of the game. You will find the gameplay much more intense and entertaining. spoilerVehiclesspoiler and spoilerroadsspoiler can make the game monotonous, so I advice using them sparingly or not use them at all. I advice to not use any of the Director's Cut new items. They destroy the essence of the game. - You have A LOT of collectibles, weapons and tools to discover, use, craft, etc. - The ambience of this game is amazing. The overall vibe of it. It's just perfect. The Bad: - The spoilerdrivingspoiler mechanics in this game are one of the most infuriating mechanics I had the disgrace to experience. They are just awful, there is not a single spoilervehiclespoiler made to be spoilerdrived outside the roadsspoiler, and yet you are forced in some orders missions to use them in a very complicated terrain. - The physics... 99 of the time I have failed an order, it was because of how the physics work. I cannot explain them properly but anyone who has played the game knows how it feels to be walking down SLOWLY a slope and then the game detects the slope as some kind of massive cliff because you step on a small rock. Killing you andor destroying your cargo in the process. If this doesn't make any sense, it's because it doesn't make any sense. But it's how the game works. - spoilerYou can't keep the tutorial outfit.spoiler list h2Conclusionh2 list Those are the only things that annoys me. And I think those can be negative for both lovers and haters of the game so that's why I include them. That said, the game is super fun and entertaining and I am so happy that games like this exist. It's not a game for everyone, but it was certainly for me. list Мне правда нравиться эта игра, в какой-то момент она спасла на время от игровой импотенции. Да здесь проблема с транспортом, но геймплей, сюжет, графика и какая-то своя атмосфера у этой игры. Я сильно проникся Семом Портером-Бриджесом, как-будто чувствовал каждую килограмм груза, чувствовал искреннюю благодарность рандомному китайскому другу который поставил мост, убежище, транспорт и также старался помогать другим. Сюжет это отдельная история, в игру вложили душу за исключением физики транспорта. Я люблю ее, а она меня. 910 -1 балл за транспорт, а так жду вторую часть на пк. Да! [Update 221]",1001042.0110395189,1998748.1374420095,1414507.2834971342
1868140,DAVE THE DIVER,2026-07-12,118202,96.95155708519246,"Adventure, Casual, RPG, Simulation",Adventure;Casual;RPG;Simulation,12.806904479860231,7.753635115722976,"5,000,000 .. 10,000,000",1832,"10 de 10 画风不错 The games atmosphere, game play, and humor make this so much fun to play. It took me a minute to get used to but I'm really enjoying this title! Very good game with a large variety of game play styles. Runs well on the Steam Deck and Asus Ally X. หรอย [Update 222]",4978633.765871591,10046169.69181242,7072213.2070047995
1937780,Total War: PHARAOH,2026-10-30,3401,65.17352374168637,,,0.0,0.0,"200,000 .. 500,000",1732,"原价卖就是依托打完折45我只能说这个是好游戏 Не зашло. Есть интересные наработки, но в общем пока что считаю, что это зря потраченные деньги. There are some proves by National Geographic that during the bronze age, where the Egyptians lived in Sahara, there wasn't a desert but ocean-side, and they found whale fossils nearby. So desert theme is kinda unrealistic. I really start to have a feeling like CA doesn't even try with total war games anymore. This game is basically copy and pasted troy total war. Unfortunately quality of total war games have declining since Shogun 2. If you really like Egyptian setting and game is atleast -75 off its worth it but for me this game is not worth it The optimisation is great. Running it at 1080p Medium-low mostly medium settings on my Core 5 Ultra 125h no dGPU [Update 223]",196175.79367783028,501984.19332924404,313810.6874217158
2001120,Split Fiction,2028-03-30,52781,96.6415668898212,"Action, Adventure",Action;Adventure,50.76918408705348,49.4607861892364,"2,000,000 .. 5,000,000",1225,"super cool game liek Love it3 my brother is in mexico, i live in Miami , I have not seen him for at least 3 years. we play this game and hedivers every night, just amazing thank you This the good stuff 1010 W [Update 224]",2001263.3091861436,5016465.789257589,3168480.5389695424
2004210,Euro Truck Simulator 2 - West Balkans,2026-11-17,1656,84.19741287220386,"Indie, Simulation",Indie;Simulation,9.02539581792923,9.109036199620142,"0 .. 20,000",1734,"Absolútne najlepšie mapové DLC, krásna krajina, veľa okresiek, maličké mestá. Veľmi pekne vystihnutá atmosféra Balkánu ' 和来自阿尔巴尼亚的友人一起玩因为地图对现实的还原度太高了甚至可以听到他说再往前走会有一个环岛这里应该有座警察局或者指着某些地点讲述他的回忆比如在某座桥底下睡了一晚上之类的不过地图略过了他的城市让他微微SAD了一下......XD 不知道什么原因走到一段路游戏就崩溃了优化不好 I absolutely recommending this DLC for everyone especially for people from Balkans [Update 225]",0.0,20088.094947592082,0.0
2050650,Resident Evil 4,2022-02-27,120675,96.58868929225545,,,0.0,0.0,"5,000,000 .. 10,000,000",3468,"Sospecho que Ada y Ashley son sospechosas :steamhappy: Excelente juego después de mis 234 horas lo recomiendo 100 Melhor de todos !!! chevere 1010 Це саме краще, що я грала..... [Update 226]",5057616.630437075,9899823.172143536,7075981.226220111
2066020,Soulstone Survivors,2028-07-26,21365,91.03423568426433,"Action, Indie, RPG",Action;Indie;RPG,8.08637165631408,5.209928123577182,"500,000 .. 1,000,000",1137,"For me this is simply the best Survivors game by a landslide. There's so many characters to unlock, skill trees, build variety, and the list goes on. If you love unlocking and trying new stuff this game will give you so much bang for your buck. I'm almost at 40 hours and still haven't fully unlocked everything for 1 character yet. 910 experience for me. Dear god let us skip the titanhunt boss cutscenes I fkin hate spiders i don't need to stare at any of the bosses after seeing them the first time it's great besides that Лол релиз Ha merecido la pena pagar el early access y esperar hasta que saliese la 1.0. Vicio gordo vaya Endless Yes [Update 227]",498580.29094558733,1004011.9221632689,707517.1773639146
2104890,RoadCraft,2028-07-03,7494,73.47030393476503,"Adventure, Simulation",Adventure;Simulation,28.12366728514357,28.197056008171923,"200,000 .. 500,000",1170,"The game crashes constantly. Two save files corrupted. One of which had 13 hours on it. This game is honestly terrible. Песочница с машинками для настоящих мальчиков Было очень спокойно и безмятежно, пока я не погрузил в течении 40 минут 27 стальных балок на тяжёлый перевозчик, медленно начал ехать на базу, грузовик задел камушек, начал трястись как ядерный атом и грузовик начал просто на куски разлетаться по всей карте, будто попал в чёрную дыру, резко вернул летающий перевозчик на базу, а все эти 27 несчастных стальных балок застыли в воздухе и их не достать. А так игра очень успокаивает нервы конечно. it is the best only car game get it now Got to play once and now game wont launch just black screen then doesnt respond cant even get refunded waste of 50 dollars I expect to see bugs this early in the development phase. The bugs I have experienced are minor except for one that just recently happened. My game save of 60.2 hours was completely erased. I am hoping this matter can be resolved but it is not the end of the world to start over. The game is enjoyable and fun. Great concept. With developers that actually care and listen, this game is not only a hit but, has to opportunity to remain one for a long time. Keep up the great work. If you have patience and time, then this game is for you. [Update 228]",199492.50663834484,501583.71029402217,316326.0843742037
2669320,EA SPORTS FC™ 25,2027-11-15,71060,50.0,"Simulation, Sports",Simulation;Sports,69.48718675482812,70.61635757142342,"5,000,000 .. 10,000,000",1411,"Game not the same MISERABLE fifa 24 e bem melhor, fifa 25 muito bug Regelmäßige Abstürze des Spiels, reichen denke ich schon Genuinely the worst game I've ever played. Please for the love of god do not buy it, I only got it to degen SBC's but they can't even do that fucking shit right. Please never touch this game, worst thing I've ever played. [Update 229]",4985252.516085399,10124774.207267374,7104544.749072683
2133520,Ertugrul of Ulukayin,2028-08-05,260,92.29333910426504,,,0.0,0.0,"0 .. 20,000",1157,"Oyun gerçekten çok güzel gerek hikaye olsun gerek grafikler olsun gerek seslendirmeler ve oynanış olsun.Tabi ki bir AAA oyun değil fakat gerçekten güzel bir oyun var önümüzde.Optimizasyon daha iyi olsa çok daha güzel olur oyunu hep 15-20 fps arası oynadım , erken erişim bitmeden umarım düzelir çünkü bu yavaşlık oynayışı olumsuz etkiliyor.Gün geçtikçe çok daha iyi optimize edilmiş bir oyun olacağına inanıyorum.Menü tasarımı oynanış ve dövüş mekaniklerini çok keyifli buldum.Oyunu ve yapımcıyı çok daha iyi yerlerde görmek dileğiyle 3 too many bugs but good game Oyunun chapter 1 ve chapter 2 aşamalarını 100 oynayıp bitirdim ve bazı hem eleştiri hem de fikirler elde edindim, 1. chapter ile ilgili sıkıntılar mevcut bunlar klasik erken erişim problemleri fakat üstesinden kesinlikle çok rahat gelinebilir. Bazı ses hataları var, görsel yırtılmalar ve fps droplar hissediliyor oynanış açısından combat mekaniği videolarda gördüğüme nazaran daha iyi ama daha da iyi olabilir atak yaparken bazen vurduğum karakterler arasında kaybolma sorunu yaşadım. 2.Chapter ile ilgili fikirlerim tamamen olumlu, görsel açıdan 1. aşamaya göre aşırı iyi oynanış mekanikleri de ekleniyor. Karakterler arasındaki geçişler ve hikayeleri birleştirme çalışmaları çok güzel. Hikayeyi yansıtma açısını çok beğendim yine bir kaç sorun var ama düzeltilecek ufak hatalar. Başarılarınızın devamını diler sıradaki güncellemeleri sabırsızlıkla bekliyorum! Hikayesi olan, emek harcanmış bir oyun. Erken erişim olması sebebiyle eksiklikleri var ancak erken erişim zaten bunun için var. Geliştiriciye gerekli geri bildirimleri yaptım bence herkesin de yapması gerekiyor. Eskiden bacasız sanayi dedikleri turizmin yerini artık yazılım ve özellikle oyun sektörü aldı. Umarım final sürümünde tüm geri bildirimleri de dikkate alarak çok çok daha sağlam bir oyun ortaya çıkaracaklardır. [Update 230]",0.0,19910.570707523217,0.0
2138720,REMATCH,2028-08-17,2845,76.70697144906468,"Action, Indie, Sports",Action;Indie;Sports,14.936919264546948,15.057985321278402,"0 .. 20,000",1155,"一个足球游戏居然能把传球做的这么差劲......不建议用键鼠玩这游戏 令人恶心的ELO平衡机制 Bug极多 没有中国服务器 Disgusting ELO balance mechanism There are numerous bugs There are no Chinese servers available En la beta los servidores funcionaban de maravilla, pero ahora lo rompieron. Estoy a 200ms ping, injugable, llegas tarde a todas las jugadas, pelotas, tiros, atajadas. La experiencia es horrible. Cuando el servidor mejora a unos 75 - 80ms es otro juego. Hasta que no lo arreglen, no recomiendo comprarlo. The game is unplayable due to constant crashing. I have tried every fix posted online and nothing has worked. Muito Bom!!!!! [Update 231]",0.0,20324.679312459808,0.0
2141730,Backrooms: Escape Together,2025-12-21,20037,86.72125410749608,"Action, Adventure, Casual, Indie, Early Access",Action;Adventure;Casual;Indie;Early Access,5.710688407482372,5.784888469400463,"500,000 .. 1,000,000",2135,"Неплохой Гейм-Плей, звуковое сопровождение и миссии на логику. I think everyone should play this, its a really fun game from the looks of it. Its sometime laggy. But i can asure you its fun Для анрила 5 игра выигрывает свое оптимизацией. КЕЕКПЕП Отличный хорор. [Update 232]",512898.5466882716,991963.2543203027,713285.7152004739
2183900,"Warhammer 40,000: Space Marine 2",2027-11-18,121082,83.81955840272204,"Action, Adventure, RPG",Action;Adventure;RPG,40.673247693269786,39.825031391458396,"5,000,000 .. 10,000,000",1448,"2 hrs play no refund. reskinnedremapped gears of war meets for honor, but isnt nearly as fun as either. mid. Excellent ! This game is incredibly fun and satisfying! My only gripe is how short the campaign is. otherwise a blast through and through Fun and deep. I grew an extra testicle playing this game. I'm doing my part, what about you? [Update 233]",5019498.029301494,10120406.801888488,7127367.115408656
2201320,Date Everything!,2028-08-30,145,96.18847705326712,Simulation,Simulation,20.102612757954752,19.769954221360944,"0 .. 20,000",1172, [Update 234],0.0,19882.687184087456,0.0
2215390,Five Nights at Freddy's: Secret of the Mimic,2028-08-31,3799,81.90123238715151,Indie,Indie,30.730876613265846,25.42308972796283,"0 .. 20,000",1181,"Uma surpresa INCRÍVEL dentro de uma franquia lendária! The Secret of the Mimic é MUITO superior ao Security Breach em absolutamente todos os aspectos: direção de arte, sustos, narrativa e ambientação. A única crítica vai para o FPS travado em 60, mas felizmente há uma solução simples: Ative o V-Sync, pressione F11 uma vez para colocar em modo janela e depois novamente para voltar ao modo tela cheia. Pronto! O jogo passa a rodar na taxa de atualização do seu monitor. Is it fun: yes Is it kinda short: yes Is it worth 40: no, I'd wait for a sale Very secretive eh? es el mejor juego de fnaf hasta el momento muy buenos graficos muy buena jugabilidad recomendadisimo [Update 235]",0.0,19879.622557759754,0.0
2248760,Car For Sale Simulator 2023,2028-01-25,17932,80.16544011610723,"Indie, Simulation",Indie;Simulation,17.676117626970047,13.319051326174538,"200,000 .. 500,000",1410,"güzel oyun ama kısa surede bıtıyor нтересная игра про перекупство my fav simulation game h1 Достали h1 В последнее время этих симуляторов как говна расплодились. начиная с 2023 года и по сегодняшние дни бездарные разработчики клипают третесортное говно, с одинаковой графикой, ужаснейшей оптимизацией, одними и теми же багами за дикий оверпрайс. меня достало, что мой любимый жанр ставят на конвеер, приправляя это мультиплеером. и это вина тех, кто продолжает это покупать и жрать говно в 30фпс. подобная какафония уже была с мобильными играми, где студии по типу voodoo пилили чуть ли не по несколько игр за месяц, там были все вышеописанные проблемы, только еще и куча рекламы, ведь на мобилки игры никто покупать не будет. я очень надеюсь, что скоро спрос на эти игры упадет до нуля и все горе программисты пойдут дворы мести, как они делали до всего этого цирка уродов. Лучше бы вместо клипания однообразного говна из года в год, сделали бы нормальный симулятор и поддерживали его годами, как это делают те же scs softgamingно даже они из за отсутствия конкуренции особо не потеют. А именно эту игру убил выход в релиз, где представили ебать какую новую картугде 90 местности пустота и ехать от точки А до точки Б просто дольше стало и убил и так нулевую оптимизацию. öncelikle oyun çok iyi zaman geçirmek için ama kasaba büyütülmeli ve araba çeşitleri artmalı her zaman lüks araç merkezinde hep aynı 4 araba oluyor [Update 236]",200748.11313969514,506138.34496236645,318757.45911090955
2272540,FBC: Firebreak,2028-09-14,590,52.3951794906544,Action,Action,19.690232467505034,19.724204303882363,"0 .. 20,000",1187,"I'm genuinely at a complete loss at these unhinged negative comments. This is a stellar game. Yes, you get 5-6 jobs, at different clearance levels and different difficulties. But there's a million unlockables that don't need ANY MTX, and the DLC is cosmetic only. Not to mention the different kits and weapons you can use to vary up the experience, and generally just the experience of grouping up with others, leading to a different dynamic. You can also ping points of the map - so although there's no chat, you can still communicate. It's not a massive loss in my opinion - though I suppose it'd be nice in non-invite games. There's some connection issues though they're pretty temporary - and issues are addressed as quickly as possible. I trusted Remedy to provide a good experience, and the 2.5 hours I spent on it has told me all I need to know. That money is well-earned. If you care about money-to-time ratio, then maybe this game isn't for you, YET. But if you care about literally anything else as well, then I suggest you at least give it a shot. At the very least try it, with good intentions. You won't regret it. It's a damn good game. And it feels good to play. Me and a friend were really looking forward to this one. Came out of it with a reminder as to why I don't play triple A slop. Loved Control, but this was a huge disappointment. Played 2 matches; they were the exact same with zero variation. I admit that I only played for less than an hour, but it was enough. I am a simple man. I see Remedy, I invest. But all jokes aside. I wasn't really feeling this one, until it just clicked... after playing it with 3 randos online. It is a fun game, but it does get old quick, and intentionally so i believe. It does need some more content, but overall i am quite pleased with it. Give it a shot through gamepass or something if you are on the fence about it. It is quite an enjoyable experience for someone who doesn't have too much time for games due to studies, work etc. well it has it lunch flaws but it is n fun multiplayer helldiverslike idk how to call it game. U can have some fun with ur friends in the control universe. [Update 237]",0.0,20022.68001265452,0.0
2294660,The Quinfall,2028-04-28,6123,50.0,"Massively Multiplayer, Early Access",Massively Multiplayer;Early Access,15.881126123601952,15.831588287056832,"200,000 .. 500,000",1336,"Срань просто редкая! когда по квесту дошел до мобов и увидел как они стоят ну это что с чем то как мандавошки на лобке,и фишка что ты мимо них пробежал спокойно,от них никакой реакции просто переборщили с ними реально играть ну просто в это? ну ппц это не говоря об оптимизации .... В такой кал я играть не готов. why i cannot creater character, it shows error code 02, this is just a waste of money. Игра огонь Оптимизация полный отстой Надеюсь они собираются исправить этот недочёт, иначе она помрёт как и многие подобные проекты. На моём железе она должна летать на максимальных, но с такой оптимизацией она просто убогая аж глаза режет. Графические настройки приходится опускать в пол, и даже при этом фризы dope 挺好玩的 [Update 238]",201258.8271697736,495425.20466108655,315766.8374614968
