game_id,name,release_date,total_reviews,positive_percent,genres,tags,current_price,discounted_price,owners,days_after_publish,review,owner_min,owner_max,owners_log_mean
1136380,Ultimate Fishing® Simulator 2,2026-04-19,1567,67.04254631519524,"Simulation, Sports",Simulation;Sports,10.623342399905397,1.5821025506929853,"50,000 .. 100,000",386,"Game is worst than part one. First of all. One had more features and more fishing. Like fly fishing and ice fishing. In here, none of that. Plus the dumbest thing happened and it keeps happening over and over. I'll reel the fish all the way to me, the the prompt to hold right click to land the fish will pop up but then goes away and I can't reel in anymore. So I couldn't land the fish. So I left and won't be playing anymore. I'll stick to Fishing Planet. One, its got better mechanics and its free. I'll play part one for the fly fishing and ice fishing aspect. Graphics: Beautiful, especially the water, but distant objects look low quality with weather set to Noon Audio: Not too bad; some sound is repetitive however the reel noise has very little variation PC Requirements: Fast Game Size: 36.56 gigabytes as of writing this Difficulty: Easy to learn Hard to master Grind: None; you can progress quite quickly Price: Worth buying if its on sale goes 85 off Bugs: A lot of tiny bugs, but nothing game breaking or annoying. Rating: 810 spoilerReview originally generated by https:vojtastruhar.github.iosteam-review-template, then shortened by me.spoiler Полный отстой! 1-я часть на много лучше. Возврат. Game doesn't run well, super clunky and just not fun. this game came out in 2017 this is awful on graphics even on ultra settings DO NOT BUY they shouldn't be allowed to advertise this came out in 2025 when it didn't........ just buy ultimate fishing simulator 1, its newer with wayyyy better graphics also you can keep fish in an aquarium, it is also way more fun . [Update 69]",50246.343241900206,100088.87300613173,70916.14673514808
1144200,Ready or Not,2024-11-27,185928,88.57653313137617,"Action, Adventure, Indie",Action;Adventure;Indie,28.97688213407797,28.246597259574543,"5,000,000 .. 10,000,000",904,Puedo disparar y despues preguntar : its gud its fun and you have to pick gun to the mission i love it and playing by yourslef or with friends is fun as hell Ai is so fcking dogshit Controller tauglich! Spannend. Just awesome! [Update 70],5057136.294164691,9810325.277981708,7043589.427333383
1145350,Hades II,2025-04-26,60372,94.29954666291457,"Action, Indie, RPG, Early Access",Action;Indie;RPG;Early Access,15.116451746014775,13.346153232585428,"2,000,000 .. 5,000,000",764,"A worthy successor that builds on a great formula. The early access experience has been amazing and I look forward to the official release. Great game and devs keep adding как hades 1 Quite literally one of the best sequels to the best rouge-like game ever created. I'm totally not obsessed with the amount of thought and story that goes into both Hades and Hades 2 as well as the animatic effort and endless voice lines. By far one of the most challenging, entertaining, and beautifully crafted games I've ever played. Already an amazing follow up to the first Hades. Both games are a must-play in the roguelite genre. [Update 71]",1985963.731149448,4951644.447269952,3135886.841361735
1151340,Fallout 76,2021-04-09,66446,75.6002057742067,,,0.0,0.0,"2,000,000 .. 5,000,000",2252,"Затягує, щоб там не казали. Є два варіанти. Якщо Ви починаєте з друзями, то з самого початку буде нормально, весело. Якщо соло то гарний геймплей почнеться десь з 45 лвла, бо до цього моменту буде лише кач та проходження квестів. А от після того як вже щось будете мати в грі, тоді вже почнеться фан. П.С. Не вистачає лише Української. Fallout with friends! A bit laggy but still fun Played this day one on the Xbox even on day one this was an amazing game even with the bugs if anything it just gave it personality and now that is has NPCs and fishing this is a must play for anyone who is trying to get into the franchise and wants something you can casually play, but still doesnt beat Fallout 4 in being the best launch off point for anyone getting into the franchise o fallout first não vale mais o preço pelo que você recebe de átomos ou os preços caem ou o fallout first dá mais átomos até lá minha análise é negativa. [Update 72]",2019526.182529622,4927357.527046382,3154509.0801192154
1158310,Crusader Kings III,2021-09-01,80720,91.39200320545709,,,0.0,0.0,"2,000,000 .. 5,000,000",2117,"excellent Под пиво пойдёт macht Spaß Crusader Kings 3 begeistert mich vor allem durch seine beeindruckende Sandbox-Atmosphäre, die unendliche Freiheit bei der Gestaltung der eigenen Geschichte bietet. Die intrigante Diplomatie sorgt für spannende und komplexe Machtspiele, die das Spiel unglaublich fesselnd machen. Medieval sims [Update 73]",1984861.878189768,4956246.058856594,3136473.1564533967
1172620,Sea of Thieves: 2025 Edition,2021-06-08,306990,89.17087798788857,"Action, Adventure",Action;Adventure,28.515140217896526,28.25602363230827,"5,000,000 .. 10,000,000",2212,"yeah boo, bad super gra bon jeu perchè si [Update 74]",4971154.81721688,9910158.532865165,7018898.227644823
1174180,Red Dead Redemption 2,2020-12-14,683216,91.24595958575325,"Action, Adventure",Action;Adventure,61.00064251026692,58.95198384527654,"10,000,000 .. 20,000,000",2398,"bu oyunu sevmeyen birisi benimle ahbaplık yapamaz MICAH SENI BULACAM OLUM Very rich story, recommend it to dads that are tired after work, online is fun with friends, fix the anti-cheat love it masterpiece. [Update 75]",10014205.009191757,20207431.692988925,14225377.453088194
1190000,Car Mechanic Simulator 2021,2022-08-26,28731,95.96319444210404,"Racing, Simulation",Racing;Simulation,12.454750573495497,3.6306962863841195,"1,000,000 .. 2,000,000",1788,good game perfect game Reparar coches guay I'm a mechanic as a physical job though this game dose not hold every detail I do find it nice to keep my memory going with this. [Update 76],989026.5413143334,2006818.443971179,1408828.1317061451
1285190,Borderlands 4,2026-10-02,5,50.0,,,0.0,0.0,"0 .. 20,000",301, [Update 77],0.0,20382.305921301886,0.0
1321450,American Theft 80s,2023-07-10,839,75.0026218498591,"Action, Adventure, Indie, Simulation",Action;Adventure;Indie;Simulation,10.494928264285921,1.6624839066262966,"100,000 .. 200,000",1490,"master piece simulator open world stealing game, nothing more. It is a masterpiece for sure, better than their other game stealing simulator, I REALLY like the open world thing. Крутая игра Thief Simulator from Temu nawet spoko ale mozna ludzi potracic bez konsekwecji jak tomasz hajto [Update 78]",100622.8499323475,197864.7591412348,141101.79292258676
1326470,Sons Of The Forest,2025-03-23,225938,86.92881025748936,,,0.0,0.0,"10,000,000 .. 20,000,000",878,top PEAK! spoko gra jogo massa pra jogar com os amigos Franchement le jeu est très nul je suis décu les dev nous prennent pour des con l'histoire n'a aucun sens pour un jeu de survie l'immersion n'est pas bonne aucune peur sur les monstres ne l'acheter pas. [Update 79],10033594.874285417,20098881.857449964,14200846.382655442
1364780,Street Fighter™ 6,2024-07-06,36056,83.58605346054215,"Action, Adventure",Action;Adventure,29.898871055814265,30.06267587245632,"2,000,000 .. 5,000,000",1148,"amazing throw loop, do it again Don't let the review bombing affect your decision, yes old players got screwed by Capcom, but that doesn't take away from the overall experience, specially if you're a new player. This is probably the best fighting game we've gotten since the 90's, it's full of content, the mechanics are great for old and new players alike. If you enjoy fighting games, you owe it to yourself to try this game. Tekken 8 and MK1 have no chance against this gem. Os engravatados venceram, eu comprei um boneco. 好玩爱玩 好玩爱玩 [Update 80]",2040947.9784226047,5005743.0734106945,3196319.947405221
1466860,Age of Empires IV: Anniversary Edition,2022-12-07,61128,86.77563142736649,Strategy,Strategy,19.877404603569072,20.497597632463055,"2,000,000 .. 5,000,000",1735,"Gud its very good game , but last dlc fucked game tempelar and lancaster its very very unfair 挺不错的 是一个难得的rts爽游 NiCE [Update 81]",2027935.871575405,4980504.480449512,3178072.3236650215
1562430,DREDGE,2024-05-13,37272,94.51753826970995,"Adventure, RPG",Adventure;RPG,12.575687827353807,6.306045687979414,"1,000,000 .. 2,000,000",1222,"Historico. Es el juego de pesca que toda persona deberia de probar. engaging, beautiful artwork. puzzles and mysteries but in a fairly unstructured manner...somewhat open world exploration... satisfying task completion mixed with open world exploration and quirky indie plot lines... excellent. Найкраща риболовля, йа йа рльєх Weirdly addictive to play Played through this game 100, absolutely loved it. The maritime themes and music are engaging, gameplay is simple but still fun and exploratory nice driving mechanics too with fun little side quests throughout the islands. The eldritch horror aspects of the game is one of the best parts and really keeps you on your toes when going for rare or hard to catch fish at times. Highly suggest giving it a try with the expansions as they add some nice depth and fun. [Update 82]",982412.6051357689,1976334.8297466845,1393404.553140256
1943950,Escape the Backrooms,2023-09-30,86238,89.98038391111994,"Indie, Early Access",Indie;Early Access,5.810853785223646,5.889506903755392,"2,000,000 .. 5,000,000",1458,... dehşet vahşet oyun efsane хорошая игра но вернул потомучто хотел в другую bok gibi oyun oyunun anasını s1kmisler önceden daha iyiydi keske guncelleme getirmeseydiniz daha bombok etmişsiniz yapacağınız işi s1keyim 1 kaç insan evladı bulunca cook sarıyor benimkiler oe olduğu için ama yinede sardıı [Update 83],2017321.410320856,4994821.195004919,3174296.731152875
1601570,The Alters,2026-08-07,2718,88.49077368836504,,,0.0,0.0,"0 .. 20,000",426,"11 bit studios foi sensacional neste jogo. A impressão que tive é que estou assistindo um grande filme em um cinema. Direção de arte, música, narrativa e todos esses fatores me fizeram continuar na frente do computador curtindo um jogo. Fazia tempo que um jogo não me chamou atenção. A jogabilidade é básica, admito. Contudo acredito que o foco seja outro. A história deste game é digna de filme. Estou gostando demais deste jogo. Team Jan In short - amazing game. I bought this game as soon as I saw an ad based on 11 Bit Studio's reputation for Frostpunk. This game has not disappointed yet, really smooth gameplay. Not certain if my decisions are good but they are interesting. Resource gathering loop is neat and doesn't feel like a grind. Wish Frostpunk 2 had gone in this individual storytelling direction instead of macro. This could become one of my favourite games. 話の内容や世界観等はとても良く続きは気になるが これは普通にムービーゲーでよかったのではと思ってしまうほどに道中が面倒くさいです 別にランダム生成でもないので決められた場所に決められたように設置物を配置していくだけで面白味がない Ｅで登れる崖を見た時に嫌な気がしたんだよなぁこの段差いるかぁ毎回テンポ悪くするだけの演出はＮＧで 素材も機械で掘るからいまいち掘っている感もないし没入できない あとセーブが一日単位なので時間に追われてる人にはオススメできないですその１日もムービーとかの入り次第で時間がすごい変動するからプレイタイムが読めないのがあまりにもネック ストーリーが気になる人で指示通り動くのが好きな人間にはいいんでは [Update 84]",0.0,19943.72297868978,0.0
1650010,RIDE 5,2024-10-22,1830,78.1676534019025,"Racing, Simulation, Sports",Racing;Simulation;Sports,59.076255793803995,12.134589233348386,"50,000 .. 100,000",1090,Normal motosiklet kullanmak daha kolay aw good game slightly touchy controls but get used to them and all that then its a fun great game to mess with 1등 하기 X 1랩이라도 안박고 돌아보기 O Bangeer Ist Super im sale auf jedenfall kaufen [Update 85],50187.79403399582,98628.41062027687,70355.82675309005
1671210,DELTARUNE,2026-08-08,37848,98.18329912304843,"Indie, RPG",Indie;RPG,12.372609014687713,12.425818022024647,"1,000,000 .. 2,000,000",445,"bGraphicsb bGameplayb bDifficultyb bPerformanceb bStoryb bLengthb bWorthb b--- 4 5 ---b iplaying this game really makes me want to see more of this world and it gives me a sort of feeling that i haven't felt or couldn't replicate since undertale. cannot wait for the next chapters and how this story unfolds.i deltapeak przeszedłem wszystko co narazie jest, i musze przyznać wow, fabuła jest bardzo dobra gameplay też naprawde 1010 Absolute deltarune, obra maestra, 2010 y GOD all i hope is that it doesnt take another 7 years for the next three chapters to release [Update 86]",989407.8647811105,1998746.4180545365,1406262.9290876696
1850570,DEATH STRANDING DIRECTOR'S CUT,2023-06-08,29334,92.47757116025062,"Action, Adventure",Action;Adventure,5.794403181510001,2.3181533754349486,"1,000,000 .. 2,000,000",1612,"kojima please can my feet fedex The only way to know if you will like it is bby playing it yourselfb. But, I wanna ramble a bit so here's my review: One of the best games I have played in my life. Finished it thrice on playstation platinum and once on PC 100 as well. h2The Storyh2 list While a bit confusing, it's super unique, emotional and have a lot of moments that definitely stick with you. I'm not gonna say anything else about it, experience it yourself, don't watch trailers or anything. list h2The Gameplayh2 list The Good: - The most important thing in my opinion, you bALWAYSb feel like that you are helping other players. All the time. The only connection that you have with other people is positive, you only interact with other players to help them or be helped by them. And the game gives you constant feedback in that regard with messages telling you how you are being useful to them. - I personally find the gameplay loop to be super engaging delivering packages. Playing on Very Hard and going everywhere by foot it's how I recommend playing it, at least the vast majority of the game. You will find the gameplay much more intense and entertaining. spoilerVehiclesspoiler and spoilerroadsspoiler can make the game monotonous, so I advice using them sparingly or not use them at all. I advice to not use any of the Director's Cut new items. They destroy the essence of the game. - You have A LOT of collectibles, weapons and tools to discover, use, craft, etc. - The ambience of this game is amazing. The overall vibe of it. It's just perfect. The Bad: - The spoilerdrivingspoiler mechanics in this game are one of the most infuriating mechanics I had the disgrace to experience. They are just awful, there is not a single spoilervehiclespoiler made to be spoilerdrived outside the roadsspoiler, and yet you are forced in some orders missions to use them in a very complicated terrain. - The physics... 99 of the time I have failed an order, it was because of how the physics work. I cannot explain them properly but anyone who has played the game knows how it feels to be walking down SLOWLY a slope and then the game detects the slope as some kind of massive cliff because you step on a small rock. Killing you andor destroying your cargo in the process. If this doesn't make any sense, it's because it doesn't make any sense. But it's how the game works. - spoilerYou can't keep the tutorial outfit.spoiler list h2Conclusionh2 list Those are the only things that annoys me. And I think those can be negative for both lovers and haters of the game so that's why I include them. That said, the game is super fun and entertaining and I am so happy that games like this exist. It's not a game for everyone, but it was certainly for me. list Мне правда нравиться эта игра, в какой-то момент она спасла на время от игровой импотенции. Да здесь проблема с транспортом, но геймплей, сюжет, графика и какая-то своя атмосфера у этой игры. Я сильно проникся Семом Портером-Бриджесом, как-будто чувствовал каждую килограмм груза, чувствовал искреннюю благодарность рандомному китайскому другу который поставил мост, убежище, транспорт и также старался помогать другим. Сюжет это отдельная история, в игру вложили душу за исключением физики транспорта. Я люблю ее, а она меня. 910 -1 балл за транспорт, а так жду вторую часть на пк. Да! [Update 87]",1006161.0665401975,1989425.520290006,1414808.2920654938
1868140,DAVE THE DIVER,2024-09-10,117019,96.59225046335575,"Adventure, Casual, RPG, Simulation",Adventure;Casual;RPG;Simulation,12.917382588428922,7.678284477086787,"5,000,000 .. 10,000,000",1162,"10 de 10 画风不错 The games atmosphere, game play, and humor make this so much fun to play. It took me a minute to get used to but I'm really enjoying this title! Very good game with a large variety of game play styles. Runs well on the Steam Deck and Asus Ally X. หรอย [Update 88]",4990423.358804336,10005747.400302429,7066322.632654484
1937780,Total War: PHARAOH,2024-12-29,3367,62.8585987549796,,,0.0,0.0,"200,000 .. 500,000",1062,"原价卖就是依托打完折45我只能说这个是好游戏 Не зашло. Есть интересные наработки, но в общем пока что считаю, что это зря потраченные деньги. There are some proves by National Geographic that during the bronze age, where the Egyptians lived in Sahara, there wasn't a desert but ocean-side, and they found whale fossils nearby. So desert theme is kinda unrealistic. I really start to have a feeling like CA doesn't even try with total war games anymore. This game is basically copy and pasted troy total war. Unfortunately quality of total war games have declining since Shogun 2. If you really like Egyptian setting and game is atleast -75 off its worth it but for me this game is not worth it The optimisation is great. Running it at 1080p Medium-low mostly medium settings on my Core 5 Ultra 125h no dGPU [Update 89]",203928.5059339898,499013.8916457324,319003.3814297587
2001120,Split Fiction,2026-05-30,52263,96.94383597515458,"Action, Adventure",Action;Adventure,49.879537297193345,50.29702193335171,"2,000,000 .. 5,000,000",555,"super cool game liek Love it3 my brother is in mexico, i live in Miami , I have not seen him for at least 3 years. we play this game and hedivers every night, just amazing thank you This the good stuff 1010 W [Update 90]",2015150.154200946,4973474.942619474,3165801.4463219536
2004210,Euro Truck Simulator 2 - West Balkans,2025-01-16,1640,83.71209087967766,"Indie, Simulation",Indie;Simulation,9.076804117987606,9.085135552622695,"0 .. 20,000",1064,"Absolútne najlepšie mapové DLC, krásna krajina, veľa okresiek, maličké mestá. Veľmi pekne vystihnutá atmosféra Balkánu ' 和来自阿尔巴尼亚的友人一起玩因为地图对现实的还原度太高了甚至可以听到他说再往前走会有一个环岛这里应该有座警察局或者指着某些地点讲述他的回忆比如在某座桥底下睡了一晚上之类的不过地图略过了他的城市让他微微SAD了一下......XD 不知道什么原因走到一段路游戏就崩溃了优化不好 I absolutely recommending this DLC for everyone especially for people from Balkans [Update 91]",0.0,20319.422544504163,0.0
2050650,Resident Evil 4,2020-04-28,119479,97.42570104618942,,,0.0,0.0,"5,000,000 .. 10,000,000",2798,"Sospecho que Ada y Ashley son sospechosas :steamhappy: Excelente juego después de mis 234 horas lo recomiendo 100 Melhor de todos !!! chevere 1010 Це саме краще, що я грала..... [Update 92]",5048431.157815221,9902773.145227592,7070605.949644119
2066020,Soulstone Survivors,2026-09-25,21151,91.03974122590877,"Action, Indie, RPG",Action;Indie;RPG,7.896535502137375,5.1038931465626804,"500,000 .. 1,000,000",467,"For me this is simply the best Survivors game by a landslide. There's so many characters to unlock, skill trees, build variety, and the list goes on. If you love unlocking and trying new stuff this game will give you so much bang for your buck. I'm almost at 40 hours and still haven't fully unlocked everything for 1 character yet. 910 experience for me. Dear god let us skip the titanhunt boss cutscenes I fkin hate spiders i don't need to stare at any of the bosses after seeing them the first time it's great besides that Лол релиз Ha merecido la pena pagar el early access y esperar hasta que saliese la 1.0. Vicio gordo vaya Endless Yes [Update 93]",501468.33011804736,995112.3017654446,706411.5685959877
2104890,RoadCraft,2026-09-02,7423,73.67671355787874,"Adventure, Simulation",Adventure;Simulation,27.68727471378833,28.462230943656813,"200,000 .. 500,000",500,"The game crashes constantly. Two save files corrupted. One of which had 13 hours on it. This game is honestly terrible. Песочница с машинками для настоящих мальчиков Было очень спокойно и безмятежно, пока я не погрузил в течении 40 минут 27 стальных балок на тяжёлый перевозчик, медленно начал ехать на базу, грузовик задел камушек, начал трястись как ядерный атом и грузовик начал просто на куски разлетаться по всей карте, будто попал в чёрную дыру, резко вернул летающий перевозчик на базу, а все эти 27 несчастных стальных балок застыли в воздухе и их не достать. А так игра очень успокаивает нервы конечно. it is the best only car game get it now Got to play once and now game wont launch just black screen then doesnt respond cant even get refunded waste of 50 dollars I expect to see bugs this early in the development phase. The bugs I have experienced are minor except for one that just recently happened. My game save of 60.2 hours was completely erased. I am hoping this matter can be resolved but it is not the end of the world to start over. The game is enjoyable and fun. Great concept. With developers that actually care and listen, this game is not only a hit but, has to opportunity to remain one for a long time. Keep up the great work. If you have patience and time, then this game is for you. [Update 94]",201763.27951389892,499960.13679341687,317606.04028522084
2669320,EA SPORTS FC™ 25,2026-01-14,70361,50.0,"Simulation, Sports",Simulation;Sports,71.08381321498905,70.37889260371949,"5,000,000 .. 10,000,000",741,"Game not the same MISERABLE fifa 24 e bem melhor, fifa 25 muito bug Regelmäßige Abstürze des Spiels, reichen denke ich schon Genuinely the worst game I've ever played. Please for the love of god do not buy it, I only got it to degen SBC's but they can't even do that fucking shit right. Please never touch this game, worst thing I've ever played. [Update 95]",5104223.861527079,10139090.349618526,7193899.283191405
